Thank you, Chair. No, I wanted to just address the question of why we didn't put in, go for Hawaiian rights and again appurtenant rights which I explained why we didn’t look at that initially. And with regards to the Hawaiian rights, this being our first process of doing an application like this after the application was submitted, we had learned about those options and we were told that this forum here would be an opportunity to bring that up and to talk about it more. So obviously we're more than happy to abide by what the process is and to add what needs to be done. So just wanted to make sure we answered that question.
Because you said, Mrs. Mundy, is it your grandfather or grandmother they are related to the Ho‘opi‘is who are from the area?
No, they're very close friends.
Oh, close friends okay.
Yes, and they worked at the farm, the taro farm before.
But you are not from, are you from this ahupua‘a? Are you from this area? Jodie Mundy: Yes, I am. I was brought up here.
Do you know whether your family also grew taro in this area? Jodie Mundy: Yes, yes.
Okay, okay. So, I think the point that we're trying to make is you may have the right to continue to exercise traditional customary practices independent of any appurtenant rights. Your rights run with the land as someone who has a lineal connection to that place through your ‘ohana, that you have independently traditional customary practices that you can assert which is the forms of basis for why you have the right to use water. Which is a little different from appurtenant rights or one that comes with, I mean you have an inherent right as someone if you can show that your ‘ohana did practice there. Hōkūao, did you want to say something?
Yes, you know whether there's going to be a deferral or not, I just wanted to be on record to at least provide a little bit of our testimony in support of the Mundys and the requests for kuleana water regarding their Surface Water Use Permit. The use that they are requesting is in direct alignment with the work of our organization and you know while the staff support and recommending this approval of the water use permit is now on the table, we just would like to thank the staff for the work, the Water Commission staff for their initial support. And if the Mundys need any assistance in working on their appurtenant rights requests or just any kind of information in regards to their lineal and cultural ties to Wai‘ehu. Hui o Nā Wai ʻEhā is there to support them and happy to work with them to ensure that they are receiving the type of support on all levels. So, Hui o Nā Wai ʻEhā is again in support of their water use permit application. Mahalo.
Thank you for that offer, that's very kind of you. Do I have a...Commissioners, do you have any other questions or a motion?
I have just a reflection of what I'm hearing. It sounds like the applicant and staff have to kind of revisit the application given the additional knowledge they now have. The staff have some homework to reach out to PUC to clarify and make sure that what we're doing doesn't create more tangles and that you had a request on the Ka Pa‘akai analysis part of it, as well. So, staff have two assignments or three assignments. The applicants have another assignment. Is that, am I getting that correct?
I think so. I mean I will tell you I am, I need to have a better understanding and maybe I think Julie suggested we go into executive session, but what the impact of this MOU. Because I cannot imagine PUC asserting jurisdiction over, I mean we have to be able to work independently so. But what I'm hearing you guys tell us both Mr. Geiger and Mr. Chumbley is that the difference is it's how the water is being taken out of the system. If the Mundys would be taking water directly out of the stream as part of their traditional customary practice that's different versus they're taking it out of your system, is that correct? And the fact that they're taking it out of your system is what triggers the PUC and that order? Okay, okay. Hōkūao, do you have a clarification on that?
Yeah, I do want to make one point is that although the source of water for these two applicants are coming from Wailuku Water Company’s system, you know first and foremost that you know the original intakes and the po‘owai for these users were likely obliterated at the time of plantation which forced them to connect to these systems, but secondly the ‘auwai system that flows to these particular properties, both including the Mundy’s and Ho‘opi‘i’s and others’ below them, is actually the traditional system. A good portion of it is the traditional system. So, you know I want to make note that while maybe the intake and the source now currently comes from the Waihe‘e Ditch, the system that flows forth is still very much part of that original traditional infrastructure. And so again I don't know if that has any play in all of this, but I think that's important to note that not the entire infrastructure is not necessarily Wailuku Water Company, but the intake portion is, which has, you know, they don't have any other choice to be connected to that system. Mahalo.
It does seem like there's a factual question and then there's a legal question. Do I have a, Kaleo, do you have a recommendation? Oh Mr. Mundy, your hand is up.
Thank you, Chair. Just and again just to point out with regards to the draw on the water. We're not asking to be an additional draw on the ditch. This water is already flowing and is already servicing farmers below us and we're just asking to be able to use what's currently flowing through. And as far as being a customer I guess that would come under the decision of the PUC, but with regards to the actual use and the impact on the system we're not looking to be an additional impact on the system. It's already flowing and with regards to, as I understand the Ho‘opi‘is and not to speak for them in any way shape or form, but just to point out when you walk the Waihe‘e Ditch which flows behind our property you can see that the mechanisms for distribution still exist just at some point in time they were damaged, not repaired. And so this kuleana water flowing from you know a source up in the mountains doesn't start at the Waihe‘e Ditch. It starts at another location as Mr. Pellegrino pointed out. So, and again our intent is not to be an additional impact on Mr. Chumbley's operation, it's just to currently use what's already flowing through the area. Thank you again.
Thank you. Kaleo, did you want to make a recommendation or?
Yeah. Hearing what’s said, I think maybe to clarify the MOU with PUC and our staff conversations with their council as well as their staff. The MOU really was about consultation and data exchange and as part of this process as we're getting through and issuing new Surface Water Use Permits or going through that process, there are rules right? We have to put a public notice out. During that period that's when we expect these comments to come out. Unfortunately, for various reasons people don't always participate in that set time period and it comes up at these meetings before we get testimony or these concerns. So totally hear Wailuku Water and Commissions concerns. Similarly, we can reach out to PUC more directly per the MOU agreement and then we can coordinate that or at least ask them for their comments and their feedback on this and try to bring it back in a timely manner. So, I'm not against deferral to provide more facts and data to you folks so you feel comfortable making any decisions. I don't, I'll ask Dean, maybe Dean has any comments as well as staff that's going to have to work on this. But I guess pre- deferral or even pre-executive session if that's where you folks decide to go, you might want to take up B-3 as well since Ms. Ho‘opi‘i is here, but in the waiting room and maybe have that deferral one time. I don't know if that's an option.
Yeah, that's fine.
Yeah, I'm open to that if the, I mean is the Commission, are you open to that option? You know we'd put this in advance here B-3? Yeah, yeah because they seem to be similarly situated.
I just wanna, since she's here, give her the opportunity. Chair Chang: Yes, yes, yes.
I'm assuming the similar testimony from Avery and folks as well as Hōkūao would apply to B-3 also. Just want to make sure we get that on the record if there is a deferral, so there's direct items to staff on what those follow ups are going to be.
Right, right. Very good. I mean I think that's efficient. I respect consistency.
Okay, hang on. So, Mr. Mundy, we're going to hold your item. We're going to hear from Mrs. Ho‘opi‘i and then we're going to try to make a ruling on both, okay? So just hang on tight.
Okay, thank you.
Thank you very much and likewise Mr. Chumbley, Mr. Geiger, and Mr. Pellegrino because I suspect it's the same so just hold on tight. Go ahead, Dean.